,likenum,posttime,readnum,title
0,552,2017-10-14 07:13:00,100001,小学生作文刷爆朋友圈 | 自从当了“后妈”，生活轻松多了！
1,393,2017-10-13 06:45:00,100001,火灾中女童扔纸条救了全家：应变能力强的孩子，是这样培养出来的
2,1198,2017-10-12 06:52:00,100001,10年跟拍5个孩子，反差巨大，值得所有父母深思
3,892,2017-10-11 06:45:00,100001,女儿，我希望你以后不要那么乖
4,2340,2017-10-10 06:42:00,100001,《那年花开月正圆》大结局，“大女主”孙俪竟也是个育儿高手
5,550,2017-10-09 06:37:00,100001,教育的最后，拼的都是父母的态度
6,518,2017-10-08 07:23:00,100001,10岁女童上大学：那些天才孩子，后来怎么样了？
7,623,2017-10-07 07:13:00,100001,伤孩子最深的永远是这两个字
8,603,2017-10-06 07:00:00,100001,孩子内向？恭喜你，这是好事
9,803,2017-10-05 07:33:00,100001,家有男孩，请别伤害他
10,427,2017-10-04 07:19:00,100001,邓超：爸爸越有趣，孩子越幸福
11,536,2017-10-03 07:02:00,100001,好好爱那个帮你带孩子的老人
12,334,2017-10-02 07:01:00,100001,不要再担心孩子三分钟热度，这样做妥妥没问题
13,508,2017-10-01 07:19:00,100001,扎心了！每天拥抱孩子居然有这么神奇的效果
14,875,2017-09-30 06:47:00,100001,李湘女儿王诗龄活得那么拼，你千万不要只带孩子玩“王者荣耀”
15,101,2017-09-29 06:48:00,100001,妈妈，你的时间都去哪儿了？
16,1300,2017-09-28 06:45:00,100001,痛心！开学没多久10起跳楼，到底该怎么告诉孩子珍爱生命……
17,542,2017-09-27 06:52:00,100001,孩子吃饭难？这篇解决99%孩子的吃饭问题（爸妈必看）
18,1261,2017-09-26 06:57:00,100001,深夜一个女人的咆哮，刷爆朋友圈！虐哭妈妈的“马虎”孩子，其实很冤枉
19,78,2017-09-25 06:48:00,100001,这种未来必备技能，你打算如何让孩子接触？
20,185,2017-09-24 07:42:00,100001,决定孩子一生的不是学习成绩，而是……
21,736,2017-09-23 07:49:00,100001,那些年父母吵过的架，都进入了孩子的灵魂……
22,1275,2017-09-22 06:49:00,100001,一小学“叫停”作业家长签字 | 育儿套路深，家长莫当真
23,752,2017-09-21 06:47:00,100001,当了妈后，她只是看上去很坚强
24,1187,2017-09-20 06:40:00,100001,爱吼孩子的陈小春，是怎么养出“小暖男”Jasper的？
25,642,2017-09-19 06:52:00,100001,学好语文的第一步，70000个孩子出口成诗的秘籍
26,786,2017-09-18 06:48:00,100001,孙俪：一流的父母，从不做孩子的差评师
27,452,2017-09-17 07:40:00,100001,妈妈太强势，儿子就弱了
28,504,2017-09-16 07:40:00,100001,告诉孩子：懂得拒绝，才能活得不纠结
29,407,2017-09-15 06:54:00,100001,你的亲密，正成功“废掉”孩子
30,388,2017-09-14 06:55:00,100001,那个早早“独立”的孩子，为什么伤害更多？
31,577,2017-09-13 06:45:00,100001,世界正在偷偷惩罚“不陪孩子的父亲”
32,452,2017-09-12 06:48:00,100001,孩子“慢半拍”，是件好事
33,483,2017-09-11 06:41:00,100001,爸妈“戒吼”的四层境界，你在第几层？
34,1492,2017-09-10 07:51:00,100001,中国女人累成世界第一，该怎么狠狠爱她们？
35,509,2017-09-09 07:58:00,100001,薛之谦 ：走过逆境的孩子，终将收获幸福
36,555,2017-09-08 07:02:00,100001,好好爱那个早恋的孩子
37,3605,2017-09-07 06:53:00,100001,产妇跳楼，也许是她唯一的表达方式
38,1228,2017-09-06 06:45:00,100001,孩子内向？恭喜你，这是好事
39,273,2017-09-05 06:55:00,100001,孩子有了这种能力，人生才可能了不起
40,481,2017-09-04 06:55:00,100001,父母“不讲道理”，孩子更优秀
41,1449,2017-09-03 07:46:00,100001,她一生缺爱，却让孩子活出了幸福的样子
42,912,2017-09-02 07:44:00,100001,“抱娃被民警绊摔”刷爆朋友圈，我最心疼孩子
43,1120,2017-09-01 07:31:00,73023,变脸不变心
44,203,2017-08-31 06:46:00,100001,如何让孩子拥有超群记忆力？
45,61,2017-08-30 06:44:00,73457,假如可以为孩子一键定制朋友圈……
46,303,2017-08-29 06:45:00,100001,一分钟自测天赋，让孩子少走90%的弯路
47,754,2017-08-28 06:47:00,100001,老大打老二，不是为了争宠，而是......
48,168,2017-08-27 07:52:00,100001,老公是育儿路上的绊脚石？孙俪、袁咏仪重重地点头
49,536,2017-08-26 07:45:00,100001,有教养的孩子，善待他人又不委屈自己
50,2796,2017-08-25 06:43:00,100001,告诉女儿：这5种情况下不要善良
51,586,2017-08-24 06:48:00,100001,爸妈不炫富，他们只炫你
52,436,2017-08-23 06:47:00,100001,一流的父母，这个底线坚决不碰
53,105,2017-08-22 06:45:00,77099,给孩子讲一万次牛顿的故事，不如让孩子做这19个实验
54,632,2017-08-21 06:41:00,100001,哪个妈妈不是一边崩溃一边修炼成精呢？
55,776,2017-08-20 07:49:00,100001,为什么孩子犯了错，反倒冲你发脾气
56,603,2017-08-19 07:50:00,100001,妈妈别内疚！你不欠孩子的，父母也不欠你的 |没有完美原生家庭
57,106,2017-08-18 06:45:00,42781,10分钟改变孩子，魔力科普故事塑造好行为、大格局 |《神奇图书馆》特惠上线
58,459,2017-08-17 06:41:00,100001,爸妈三观正，是孩子一生的福气
59,761,2017-08-16 06:49:00,100001,南京猥亵女童案最新 | 为何孩子遭性侵时不喊不叫不反抗？（爸妈必读）
60,715,2017-08-15 06:49:00,100001,有个会花钱的妈妈，是一个家庭最大的福气
61,646,2017-08-14 06:45:00,100001,控制不住脾气的妈妈：这个“综合症”可能是罪魁祸首
62,674,2017-08-13 07:43:00,100001,谁说房间凌乱的家庭，养不出有出息的孩子？
63,319,2017-08-12 07:46:00,100001,孩子的幸福，从父母的这个动作开始
64,828,2017-08-11 06:45:00,100001,王菲 | 妈妈精神独立，对孩子有多重要
65,855,2017-08-10 06:43:00,100001,一个妈妈最心酸的一年是怎样的？
66,331,2017-08-09 06:47:00,100001,为什么父母越禁止，孩子越喜欢做？
67,477,2017-08-08 06:46:00,100001,这样惩罚孩子，不打不骂，效果更好
68,742,2017-08-07 06:43:00,100001,再苦再难，也一定要亲自带孩子
69,1678,2017-08-06 07:48:00,100001,《战狼2》吴京：这才是养育男孩的最佳方式！有儿子的必须得看看
70,599,2017-08-05 07:44:00,100001,孩子太磨蹭？因为你没有用这个方法
71,279,2017-08-04 06:46:00,100001,一句“不许哭”，孩子内伤30年
72,153,2017-08-03 06:46:00,100001,事关孩子安危，这个习惯一定要改（揪心……）
73,120,2017-08-02 06:49:00,100001,为了孩子的颜值，这件事请帮他做到6岁
74,376,2017-08-01 06:48:00,100001,3分钟，50个孩子，42个被拐走
75,457,2017-07-31 06:45:00,100001,孩子哭闹耍赖，原来一句话就能搞定
76,217,2017-07-30 07:43:00,100001,妈妈请放手，这件事情让爸爸来
77,565,2017-07-29 07:48:00,100001,没有富甲天下，也能富养我儿
78,100,2017-07-28 06:46:00,58906,3次诺贝尔奖提名、养出比尔·盖茨的育儿法，究竟是什么？
79,152,2017-07-27 06:47:00,100001,这个游戏只有3分钟，却有几十个知识点
80,416,2017-07-26 06:43:00,100001,妈妈被罚20元， 用俩娃抵罚款：你家孩子是充话费送的吗？
81,243,2017-07-25 06:46:00,100001,你的这些“暗示”，可能会毁了孩子
82,134,2017-07-24 06:47:00,100001,越激励孩子越差劲，这个方法别再用了
83,2589,2017-07-23 07:45:00,100001,风靡全球的林肯公园主唱自杀，被爆遭遇性虐待6年|儿童性教育，这一点至关重要
84,2609,2017-07-22 07:43:00,100001,看完《我的前半生》，我最心疼这个孩子
85,130,2017-07-21 06:47:00,49682,正式上线24小时卖出15000份，《凯叔讲历史》的魅力在哪里？
86,322,2017-07-20 06:49:00,100001,小孩子的坏毛病，都是被冤枉出来的
87,634,2017-07-19 06:45:00,100001,孩子“窝里横”的真相，90%的家长都想错了
88,187,2017-07-18 06:43:00,100001,痛心！男孩被性侵，全因家长没有做到这3点
89,670,2017-07-17 06:55:00,100001,孩子太懂事，你该担心才是
90,945,2017-07-16 07:47:00,100001,又一个孩子自杀，这句话父母别再说了！
91,372,2017-07-15 07:46:00,100001,这位爸爸祝孩子“不幸并痛苦”，却赢得全世界点赞！
92,700,2017-07-14 06:44:00,100001,聪明的父母，从不炫耀孩子
93,297,2017-07-13 06:48:00,100001,越放纵，孩子的这种能力越强
94,328,2017-07-12 06:58:00,100001,原来，比离婚更毁孩子的是它
95,252,2017-07-11 06:45:00,100001,为什么允许孩子哭，比让孩子笑更重要？
96,357,2017-07-10 06:41:00,100001,孩子说谎了，恭喜你，这是好事
97,503,2017-07-09 07:46:00,100001,2岁女孩坠亡：熊孩子的边界在哪里？
98,485,2017-07-08 07:48:00,100001,孩子沉迷手机，背后的原因让人心疼……
99,1089,2017-07-07 06:45:00,100001,5岁丧母，父亲弃家，16岁拿着7毛钱北漂，如今他是当红明星，原生家庭伤害这么大，他却选择原谅
100,251,2017-07-06 06:40:00,100001,宋仲基&宋慧乔：当爱情走向婚姻，甜蜜还能保鲜吗？
101,649,2017-07-05 06:48:00,100001,老公不回家，每个月给你11万，你干不干？
102,480,2017-07-04 06:48:00,100001,养女儿，有件事一定不要做
103,523,2017-07-03 06:39:00,100001,“我老公真没用！”——是你不会用
104,499,2017-07-02 07:48:00,100001,孩子，别讨好这个世界，我更希望你取悦自己
105,629,2017-07-01 07:52:00,100001,“你是世界上最好的妈妈”｜泪奔，那一刻我是最内疚的妈妈
106,240,2017-06-30 06:48:00,100001,他做了一套3000个知识点的“墙书”，让厌学的女儿考上了剑桥
107,126,2017-06-29 06:47:00,100001,4个字，足以影响孩子一生
108,1448,2017-06-28 06:53:00,100001,妈妈可以和儿子一起洗澡吗？
109,255,2017-06-27 06:40:00,100001,家庭教育中，一定要一个唱黑脸一个唱红脸吗？
110,1171,2017-06-26 06:47:00,100001,纵火的保姆，与消失的边界
111,275,2017-06-25 07:44:00,100001,说谎，是孩子保护自己的第一件武器
112,378,2017-06-24 08:01:00,100001,哈哈哈哈哈哈哈哈哈哈哈哈
113,669,2017-06-23 06:48:00,100001,这一点越纵容，孩子未来越优秀
114,247,2017-06-22 06:55:00,100001,二孩护大还是护小？千万注意这些话不能说
115,246,2017-06-21 06:40:00,100001,干货 | 孩子写作业磨蹭，看电视上瘾？这招保证管用
116,651,2017-06-20 06:46:00,100001,带孩子分身乏术？这么做，你就不会那么累
117,499,2017-06-19 06:55:00,100001,孩子放学，父母第一句话请一定这样说
118,423,2017-06-18 07:40:00,100001,父亲节 | 一份不一样的礼物
119,405,2017-06-17 08:06:00,100001,200次想离婚，1000次想掐死对方，最后……|500人谈“离婚”
120,251,2017-06-16 06:50:00,100001,带孩子太累？因为你不够“懒”
121,471,2017-06-15 06:40:00,100001,正确的“戒吼”方法，保证孩子听话（建议永久保存）
122,955,2017-06-14 06:44:00,100001,没几个像样的秘密，就称不上父与子
123,1478,2017-06-13 06:49:00,100001,致老公：这样浪漫的男人给我来一打
124,529,2017-06-12 06:39:00,100001,“不及格”妈妈，才是更好的妈妈
125,654,2017-06-11 07:48:00,100001,养女儿，就该比养儿子更狠一点
126,786,2017-06-10 07:48:00,100001,妈妈三观正，是家庭最大的福气
127,252,2017-06-09 06:38:00,95242,99%的妈妈都不知道，国学这样学更高效
128,94,2017-06-08 06:54:00,100001,高考那么远，作文这么近
129,437,2017-06-07 06:53:00,100001,为什么孩子总是甩开你的手？答案这么简单……
130,781,2017-06-06 06:40:00,100001,老公的情商，决定了家庭的幸福
131,1382,2017-06-05 06:51:00,100001,富养孩子，不如先富养自己
132,820,2017-06-04 07:45:00,100001,没有这种能力，孩子的智商情商再高，也不放心
133,404,2017-06-03 07:36:00,88963,你是孩子最信任的人吗？
134,969,2017-06-02 06:47:00,100001,好好爱那个发脾气的孩子
135,180,2017-06-01 06:54:00,88782,六一节礼物|一部治愈心灵的声音电影，5亿人最爱的超级宇宙小暖男故事
136,511,2017-05-31 06:37:00,100001,给妈妈放假，对家庭有多重要
137,429,2017-05-30 07:45:00,100001,乖孩子就注定被欺负？到底该不该教孩子“打架”？
138,350,2017-05-29 07:50:00,100001,"有一种伤害叫""我是为你好"""
139,206,2017-05-28 07:38:00,41693,童年怎能不嬉游？凯叔、俞敏洪、马未都玩大了
140,103,2017-05-27 06:54:00,44989,正式开售 ｜ 《凯叔西游记》第五部凯小白首发，限量20000台
141,585,2017-05-26 06:44:00,100001,我们公开比孩子，孩子也在悄悄比父母
142,605,2017-05-25 06:48:00,82785,一个卖了2000万的儿童故事，是怎么熬出来的？
143,337,2017-05-24 06:55:00,100001,别对孩子“数到3”
144,1665,2017-05-23 06:38:00,100001,不陪孩子，我们赚再多钱也没用
145,122,2017-05-22 06:53:00,100001,“妈妈，为什么你没有小鸡鸡？”
146,256,2017-05-21 07:52:00,75441,妈妈的爱，有多少斤？ | 共读
147,660,2017-05-20 07:37:00,100001,老师罚孩子写300遍“上课不说话”，这位妈妈的做法，我服！
148,603,2017-05-19 06:49:00,100001,有多少人，做了父母就忘了如何相爱
149,588,2017-05-18 06:40:00,100001,幼升小成了残酷起跑线，妈妈怎么办？
150,899,2017-05-17 06:50:00,100001,《摔跤吧！爸爸》到底是直男癌，还是捍卫女权？
151,117,2017-05-16 06:48:00,100001,怎样不发脾气，让孩子笑着听话
152,150,2017-05-15 06:49:00,39833,全球邀约100名“儿童内容体验官”
153,451,2017-05-14 07:50:00,100001,母亲节，送你一份不一样的礼物
154,493,2017-05-13 07:53:00,100001,央视首拍家庭教育纪录片《镜子》，别让爱变成伤害
155,271,2017-05-12 06:38:00,88764,每天3分钟，国学童子功 盲购超过5000份，它到底是什么
156,1124,2017-05-11 06:51:00,100001,宝贝：盼你长大，也怕你长大
157,1406,2017-05-10 07:02:00,100001,林奕含之死：比性侵更可怕的是……
158,1486,2017-05-09 06:58:00,100001,40岁的全职妈妈离婚，没工作还带俩娃，这日子要咋过？
159,850,2017-05-08 06:48:00,100001,从孩子身上，就能看到你的婚姻
160,156,2017-05-07 07:45:00,75313,喂奶，N件囧事…… | 共读
161,1167,2017-05-06 07:38:00,100001,妈妈，你是保姆吗？
162,589,2017-05-05 06:50:00,100001,对不起，我就是那个自私的妈
163,532,2017-05-04 06:53:00,100001,养育孩子，爱与溺爱的尺度在这里
164,1604,2017-05-03 06:38:00,100001,孩子发脾气，恭喜你，这是好事
165,456,2017-05-02 06:48:00,100001,“我生养了你，你属于我”，这是最悲哀的认知
166,258,2017-05-01 07:40:00,79152,一个陌生女人的来信
167,874,2017-04-25 06:39:00,100001,当我们吼完孩子……
168,402,2017-04-24 06:47:00,100001,对孩子要求太高：因为我们不能接受自己的平凡
169,107,2017-04-23 07:56:00,57587,“噩梦”到底是个什么鬼？！| 共读
170,234,2017-04-22 07:52:00,69085,嘘……别让你爸知道…… | 共读
171,128,2017-04-21 06:37:00,56656,《凯叔讲故事》3岁了，这些福利等你来领
172,787,2017-04-20 06:47:00,100001,别养育“空心”孩子
173,545,2017-04-19 06:39:00,100001,这句话，能内伤孩子30年
174,1191,2017-04-18 06:51:00,100001,关于全职妈妈，我想告诉你这些真相
175,687,2017-04-17 06:39:00,100001,越吵越好的夫妻，都有一个秘诀
176,457,2017-04-16 07:52:00,100001,我独自带5岁娃穷游37天，写下了这些…… | 共读
177,546,2017-04-15 07:48:00,100001,当孩子满嘴“屎尿屁”，可以跟他这么聊…… | 共读
178,0,2017-04-10 06:54:00,0,因为是母亲，所以不准任何人伤害你！最小2岁，澳大利亚5兄妹联手抗击暴徒
179,0,2017-04-09 07:52:00,0,记得当时年纪小…… | 共读
180,0,2017-04-08 07:52:00,0,妈妈，你生了我，为什么还要再生一个？ |  共读
181,0,2017-04-07 06:47:00,0,别把孩子养成一个令人讨厌的人
182,0,2017-04-06 06:48:00,0,妈妈这句话，让孩子躲过一场绑架
183,0,2017-04-05 06:52:00,0,经不起挫折的孩子，小时候父母肯定没做这3步
184,0,2017-04-04 07:25:00,0,孩子离性侵很远？过于乖巧、驯良=没有自保意识？这堂课多早上都怕晚
185,0,2017-04-03 08:07:00,0,流感是最强病毒？别闹，焦虑才是
186,380,2017-04-02 07:52:00,75784,世界上最爱我的那个人，去了… | 共读
187,648,2017-04-01 06:46:00,100001,妈妈，这世上有鬼吗？ | 共读
188,137,2017-03-31 06:45:00,100001,权威儿科主任，告诉你一些诊室里来不及说的话
189,147,2017-03-30 06:42:00,84593,孩子365天开心地做同一件事，会有什么样的变化？
190,923,2017-03-29 06:47:00,100001,为什么我心疼被父母表扬的孩子？
191,752,2017-03-28 06:54:00,100001,七岁之前，请你们不要离开我
192,662,2017-03-27 06:50:00,100001,每个哭泣的孩子，都需要一个温柔的拥抱
193,423,2017-03-26 07:53:00,100001,妈妈到70岁，也要宇宙超级无敌美！ | 共读
194,448,2017-03-25 07:50:00,100001,老爸，我踢你小鸡鸡啊！ | 共读
195,143,2017-03-24 06:47:00,82565,玩这个乐器，最low的方式就是用它演奏一首曲子
196,100,2017-03-23 06:54:00,48650,顶级育儿师做你私家亲子顾问，每天10分钟扫清养育难题｜凯叔独家《心理营养育儿课》
197,2640,2017-03-22 06:57:00,100001,我的孩子是学霸，可他一年失业3次
198,656,2017-03-21 06:50:00,100001,孩子自私？大多是家长的原因，而很多家庭还在这样做
199,703,2017-03-20 06:58:00,100001,当孩子说：妈妈，我害怕！
