,likenum,posttime,readnum,title
0,65,2017-10-13 07:01:00,20692,讲真，你当妈这么「狼狈」，孩子知道吗？
1,92,2017-10-12 07:25:00,13913,开团︱颜值高、玩法多还“有故事”的拼图，小宝宝的第一套入门拼图就选TA
2,185,2017-10-11 07:45:00,25050,陈小春儿子：爸爸，你慢慢来 | 如何治愈不懂情绪表达的中国父亲？
3,113,2017-10-10 07:16:00,24062,这10个祖孙游戏让老人家也变身陪玩达人，转给家里人看看吧！
4,149,2017-10-09 07:34:00,18267,攒肚？便秘？ 给宝宝添加辅食后，务必注意这两点！
5,0,2017-10-06 08:53:00,5428,陪玩攻略之「寻宝游戏」
6,0,2017-10-03 08:25:00,6243,萌芽-小鸭鸭回家
7,73,2017-09-29 12:00:00,20830,孩子旅途吵闹？这位妈妈的方法被点赞无数
8,7,2017-09-28 07:22:00,10494,开团 | 牛津树新品0基础分级阅读，跟着小红帽、龟兔赛跑等经典故事轻松学英语
9,91,2017-09-27 07:22:00,22965,旅途太累是因为你不会玩，这10个陪玩包拿走不谢（内有征集入选名单）
10,94,2017-09-26 07:16:00,27693,别给宝宝用床围了！婴儿被床围卡住窒息身亡 丨 让孩子安睡五大法则
11,168,2017-09-25 07:23:00,24755,9块9买的材料就能有100种玩法提高宝宝认知，还有必要花几万块上早教班？
12,159,2017-09-24 09:44:00,20922,致每位压力过载的妈妈：你欠自己一个拥抱｜应对焦虑训练法
13,169,2017-09-23 08:43:00,30372,这10分钟近乎生剖的产子历险记，是近期不多见的正能量
14,76,2017-09-22 07:27:00,26077,「妈妈，你别推我，我自己跳」母亲携女跳楼来换丈夫的爱，真会幸福吗？
15,52,2017-09-21 07:28:00,12171,开团 | 牙医都在用的专业电动牙刷，全家洁牙的不二之选！
16,105,2017-09-20 07:10:00,12442,本以为孩子不蛀牙就没事，结果还是难逃牙外伤的痛！
17,269,2017-09-19 12:00:00,56797,一粒泡腾片夺走18个月孩子的命，还有多少喂药常识被忽略？！
18,251,2017-09-17 08:16:00,19178,活用「旅行故事本」， 与孩子来一趟体验式旅行
19,186,2017-09-15 07:21:00,24893,熊孩子飞机闹事全家被美国驱除出境：孩子缺的教养，总有一天会狠狠报复在你身上
20,166,2017-09-14 07:22:00,14455,开团 | 宝宝必剁的科普启蒙绘本，颜值超高又耐撕的Hello World 2来啦！
21,111,2017-09-13 07:23:00,22411,给宝宝玩的宇宙启蒙，摘下浩瀚星空的简易三步法
22,62,2017-09-12 07:19:00,23886,爆炸起火、误吞烧伤！小小电池可能是孩子安全的「大杀手」
23,189,2017-09-11 09:40:00,22533,又到秋季腹泻高发季！轮状病毒疫苗要不要打？
24,202,2017-09-09 09:25:00,22926,全年无休的主妇，到底该怎么读书？
25,157,2017-09-08 07:00:00,28817,真相近了？也许大家都忽视了这个问题
26,106,2017-09-07 07:22:00,12009,开团 | 美乐创意套组可贴可画，终于可以大胆拓宽孩子的艺术创作边界
27,405,2017-09-06 07:00:00,100001,产妇跪求剖腹被拒自杀：她不是因为疼，是因为绝望
28,90,2017-09-05 09:41:00,17359,接招！如何面对好奇宝宝的「十万个为什么」
29,188,2017-09-04 07:51:00,32122,一针难求的13价到底要不要打？能用23价替代吗？｜关于肺炎疫苗你应该知道这些
30,121,2017-09-03 12:56:00,23337,你的忍让，换得来体谅吗？
31,72,2017-09-02 08:20:00,19128,预告︱9月精选好物开团计划（建议提前收藏）
32,213,2017-09-01 07:08:00,35074,当年很穷，幸亏生了个孩子
33,137,2017-08-31 07:22:00,12001,开团︱超值返场！安全高颜值、磁力片鼻祖Magformers，萌芽独家款首发！
34,403,2017-08-30 07:22:00,23455,适合孩子的APP到底有哪些？认知数学英语启蒙都掌握！
35,194,2017-08-29 08:16:00,26196,有一种瘾，叫「吃手」｜如何戒掉孩子吃手的毛病
36,183,2017-08-28 08:19:00,21067,「摇头爷爷」狂摇孩子骇人！但不是所有「摇晃」都是错｜各阶段孩子前庭觉训练要点
37,80,2017-08-27 09:09:00,38369,算了，你们老公都这样，我也不离婚了
38,197,2017-08-26 16:12:00,25750,七年之痒，是忍是挠？
39,245,2017-08-25 08:23:00,25927,都是当妈的人，谁不是一边喊累一边死磕？
40,142,2017-08-24 07:22:00,11124,开团︱横扫多项世界级大奖! 英国《摘星星的孩子》绘本: 温暖感人、0+可读
41,241,2017-08-23 08:21:00,63124,喷泉也夺命！真的不要再带孩子在广场玩喷泉了
42,375,2017-08-22 07:26:00,42961,想让宝宝大运动不滞后，这件事情从出生就可以做起来！
43,135,2017-08-21 07:17:00,25853,孩子吃这些食物真会性早熟? 丨关于性早熟的真相
44,221,2017-08-20 09:03:00,20284,「我是弱者，你应该帮助我」，弱就有理了吗？
45,334,2017-08-18 08:18:00,35373,《二十二》｜她们的伤口又深又大，但她们总说，这个世界真好
46,90,2017-08-17 07:22:00,13746,开团︱6M+就能玩！综合五种玩具、超高性价比的智立方，小身材也大有可玩
47,862,2017-08-16 08:35:00,79180,火车站猥亵女童的男子被抓，「男同学碰了我女儿私处」却无人回应
48,274,2017-08-15 07:31:00,30376,宝宝只在家吃东西，也容易拉肚子？原来是TA在作怪！
49,219,2017-08-14 07:40:00,28977,热热热！放过坐月子的女人吧！
50,285,2017-08-13 08:52:00,19619,情绪可以当武器，但用不好就白搭
51,209,2017-08-12 08:25:00,22425,欧洲在闹「毒鸡蛋」，可我们还是建议你每天给孩子吃一个鸡蛋
52,237,2017-08-11 07:55:00,20942,宝宝分不清颜色？先观察有没有这10种迹象 丨 别轻易怀疑孩子色盲
53,201,2017-08-10 07:22:00,14441,开团︱获奖无数！比利时Smart Games经典桌游三只小猪，益智也能如此有趣
54,213,2017-08-09 08:41:00,22303,别慌！家有孕妇老人小孩的看过来 | 关于香港流感的真相
55,217,2017-08-08 08:18:00,29595,做好孩子的陪玩教练，离不开这四个关键词 | 萌芽陪玩心经
56,241,2017-08-07 07:58:00,63372,HPV疫苗内地正式上市，已婚超龄的我们有没有必要打？
57,193,2017-08-06 09:02:00,29740,是男人不作为，还是女人太努力 | 6种婚后男人的特征说明书
58,341,2017-08-04 07:23:00,20642,一个色盲孩子妈妈的来稿｜接受孩子的不完美？哪有那么容易……
59,97,2017-08-03 07:22:00,15069,开团 | 90%的经典好书它都承包了！小达人点读笔，让家里的绘本都活起来！
60,220,2017-08-02 09:15:00,26200,面瘫，怪空调咯？｜使用空调的5大误区
61,188,2017-08-01 08:13:00,31060,十级戒备！宝宝牙齿护理的十大雷区
62,382,2017-07-31 08:16:00,34379,超全！一文掌握0-3岁孩子发育进程丨哪些信号要注意，看完心里就有数了！
63,72,2017-07-30 14:30:00,21469,预告︱8月精选好物开团计划（建议提前收藏）
64,206,2017-07-28 07:21:00,35021,为什么我们很少对玩有疑惑？那是因为还没跳出陪玩“舒适区”！
65,6,2017-07-27 08:30:00,9533,开团 | 在家训练记忆力，超好上手的英国低幼桌游大脑瓜！还有逻辑狗返团
66,336,2017-07-26 08:55:00,31160,「幼儿园，你好啊！」大小宝都适合的入园准备全攻略（附绘本清单）
67,328,2017-07-25 08:16:00,27771,避孕不成功，便成人｜5类14种避孕方式哪种最靠谱？
68,345,2017-07-24 08:16:00,69946,一吻致命！｜ 不要随便亲我的宝宝，这不是矫情
69,229,2017-07-23 09:21:00,22557,这些年，我们因吵架受过的伤如何痊愈？
70,247,2017-07-21 08:37:00,26969,你们都批「驯兽式」的管教，但你们一片喊「打」就能行？
71,67,2017-07-20 07:22:00,15178,开团︱等待一年的usborne经典轨道书终于开售！小火车&小巴士带你逛英国
72,248,2017-07-19 08:06:00,31129,宝宝私处肿胀、有炎症、有分泌物是怎么回事？丨女宝私处护理3大要点4项注意
73,240,2017-07-18 08:54:00,32313,宝宝的泳衣泳镜泳圈怎么选？4大类25种游泳装备全攻略
74,257,2017-07-17 08:00:00,35363,宝宝私处护理4大要点3大误区5种常见问题全get丨男宝篇
75,259,2017-07-16 09:02:00,28283,好好说话，是婚姻里最该有的心机
76,283,2017-07-15 07:59:00,24803,「我祝福你被不公正地对待」丨刷遍朋友圈的美国首席大法官的鸡汤到底在说啥？
77,414,2017-07-14 07:53:00,38720,抓小三，侦查，找律师，举证，财产保全，离婚 | 看「我的前半生」不如看这出历时两年的离婚真故事
78,113,2017-07-13 07:22:00,14612,开团︱幼奇多洗澡玩具：独特智能水循环设计，让宝宝爱上玩水、妈妈更轻松
79,265,2017-07-12 08:32:00,24519,吃鱼吃核桃会变聪明？｜一次过了解「脑黄金」DHA
80,252,2017-07-11 07:52:00,37052,「爸爸妈妈你尽管吼，害怕了算我输」
81,269,2017-07-10 08:07:00,45036,一家三口陆续甲醛中毒！原来「猛于虎」的甲醛藏在家里这些地方
82,281,2017-07-09 11:06:00,30038,你的婚姻没输给冲突，却输给了不理解
83,175,2017-07-07 07:25:00,22408,一言不合就XX，绝对是娃们出厂时打包的技能吧
84,77,2017-07-06 07:26:00,12063,独家首发︱原版进口、超神奇透镜绘本：你眼中的大自然，原来长这样！
85,221,2017-07-05 08:04:00,30378,一款游戏引发的「血案」丨关于幼童使用电子产品，父母必须做好这3件事
86,333,2017-07-04 07:26:00,35925,女性健康第一杀手：乳腺癌，其实就在我们身边！
87,200,2017-07-03 07:44:00,30528,给娃挖耳屎花了5000块还得做全麻 丨 关于耳屎你不得不知道的事儿
88,243,2017-07-02 13:01:00,26817,你真了解你的婚姻真相吗？从这三个问题开始「婚姻体检」
89,307,2017-06-30 07:42:00,24523,萌芽「奇葩说」｜当妈当成我讨厌的那种妈，是坏事吗？
90,8,2017-06-29 07:34:00,15044,开团︱让出行倍儿轻松的出游专场：Safety 1st推车+米高trike三轮推车+mamaway恒温坐垫
91,130,2017-06-28 07:41:00,38770,杭州纵火案痛心难安！这是你与家人必须牢记的「灾难应对法」
92,266,2017-06-27 08:11:00,41576,我们不是来催生，只是告诉你真相：二胎要生隔几年好？
93,195,2017-06-26 08:23:00,44053,不要再以为铅中毒离我们很遥远，这些家中物品一定要警惕
94,234,2017-06-25 08:12:00,22210,婚姻触礁，「婚姻疗法」会是最后一根救命稻草吗？
95,159,2017-06-23 07:29:00,27972,养孩子又不是吹气球！｜教你看懂娃的生长曲线图
96,7,2017-06-22 08:10:00,12165,开团︱低于美亚六折！GiroMag磁力彩窗积木：超美光影、玩法多到超乎想象
97,200,2017-06-21 07:48:00,27300,鼻子打断！俩妈妈在游乐场当孩子面打架丨你以为只有孩子需要情绪管理吗（内含实操法）
98,171,2017-06-20 07:41:00,21777,怕黑、怕水、怕怪兽……孩子的各种恐惧从哪里来？5招教你应对
99,130,2017-06-19 08:05:00,24758,帮宝宝预防80%疾病，你只需要做好这件事！
100,139,2017-06-18 08:05:00,20007,父亲节别叫爸，会哭的！
101,148,2017-06-16 07:54:00,23108,当妈后你常常会有愧疚感吗？我会！
102,27,2017-06-15 07:55:00,13081,开团︱世界最美无字绘本，4米超大画卷，带宝宝大开脑洞、感受四季魅力！
103,93,2017-06-14 08:34:00,38926,孩子们就这样被“拐骗”走了… 丨 你最该反复给孩子进行的防拐安全教育
104,262,2017-06-13 07:27:00,38793,不穿纸尿裤≠自主如厕！真正如厕训练应该是这样的
105,143,2017-06-12 07:44:00,38603,警惕疱疹性咽峡炎，看起来像感冒，孩子却难熬！
106,42,2017-06-11 08:26:00,26867,预告︱近期团购计划（建议收藏）
107,138,2017-06-09 07:25:00,29527,每个完美奶爸身后都有个心机懒妈
108,59,2017-06-08 07:22:00,13997,"开团︱美亚高分好评! 彩虹转转塔&顽皮小乌龟: 专为0岁+设计, 小手越玩越灵巧"
109,157,2017-06-07 07:26:00,25304,辣妈修炼时间表丨Baby为何被怀疑代孕？看完真相了！
110,135,2017-06-06 07:38:00,23430,这8大技能都在孩子手上 丨 30种精细运动玩法，这样玩一个月不重样！
111,142,2017-06-05 07:34:00,23669,美国儿科学会又有新规｜果汁被踢出1岁以下婴幼儿食物清单
112,159,2017-06-04 07:42:00,20516,好好说话很重要，关键是，怎么说？
113,212,2017-06-02 08:38:00,29150,男孩患白血病生命垂危，父母连生两娃配型救子，这样沉重的爱你怎么看？
114,42,2017-06-01 07:35:00,14020,开团 | 0~6岁英文启蒙必备：Child's Play儿歌洞洞书，音频、点读、故事演绎的全能绘本！
115,140,2017-05-31 07:23:00,22214,就算现在给我一台小霸王，也没有当年的感觉了！ I  9个关于童年遗憾的故事
116,130,2017-05-30 09:31:00,18903,央视纪录片《镜子》的当头棒喝：做父母没有后悔药，孩子想跳楼谁的错？
117,167,2017-05-29 08:35:00,20584,夏日必备防蚊指南，附最热门防蚊7问答疑！
118,311,2017-05-27 07:45:00,52043,明星大闹上海迪士尼：游乐场变孩子噩梦，到底谁错了？
119,195,2017-05-26 07:22:00,25830,亲子深度玩 | 全新迪士尼探索家度假酒店体验报告
120,140,2017-05-25 08:59:00,21996,开团 | 手把手教你200个游戏，在家就能实践真正的蒙氏教育，培养孩子思维、表达、认知、沟通合作4大能力
121,161,2017-05-24 10:09:00,29883,母乳喂养最常遇到的7大疑问 | 附权威母乳喂养时间表
122,140,2017-05-23 08:37:00,21838,男神不防晒成这模样了！夏日阳光的8大危害，宝宝防晒伤4大招
123,140,2017-05-22 07:54:00,25589,逼疯的起跑线：「想上好幼儿园，必须赢在子宫里」！这种家长焦虑症你有么？
124,276,2017-05-21 08:29:00,20052,出生就被遗弃的孩子最终考上哈佛！单亲妈妈为什么可以成功
125,120,2017-05-20 07:41:00,27726,当年真的是眼瞎了？居然选了这么个「蠢」老公！
126,228,2017-05-19 07:58:00,27919,宝宝辅食添加的8大真相丨我们研究对比了5大权威辅食添加指南
127,137,2017-05-18 07:55:00,14684,开团︱萌芽定制：品质媲美大牌的两款萌系头盔，出游玩耍时刻守护宝宝安全
128,186,2017-05-17 07:49:00,25332,大数据会说话：防范儿童性侵，原来我们还有这么多要紧的事情没有做
129,149,2017-05-16 07:52:00,41275,扭扭车、平衡车、滑板车、三轮车……孩子成长中的7种车，要怎么选怎么用？｜最全指南
130,111,2017-05-15 08:01:00,19478,还在捏鼻强灌拿孩子生命安全在喂药吗？！这里有最全喂药知识
131,128,2017-05-14 09:01:00,22195,董卿：成为母亲后，我看见了最好和最坏的自己
132,8,2017-05-13 08:50:00,2823,我的超人老妈很酷，她把一地鸡毛的日子过成了诗！
133,128,2017-05-12 07:58:00,18472,狠心和暴力就能逼出来世界冠军？那你根本没看懂《摔跤吧！爸爸》
134,88,2017-05-11 07:22:00,16010,母亲节专场︱牙科诊所专供、高性价比声波电动牙刷：贴心守护妈妈健康笑容
135,28,2017-05-10 07:58:00,4557,比死亡更可怕的，是你的视若无睹，和我的无尽绝望 | 产后抑郁的两年
136,189,2017-05-09 08:06:00,31163,「房思琪式」强暴锥心刺目，何止是叹息！
137,129,2017-05-08 07:28:00,24459,25件好货推荐！美国权威育儿网站BabyCenter2017年必买榜单，让你不再花冤枉钱
138,93,2017-05-07 10:05:00,14161,原创 | 开启孩子的「内在驱动力」，你还需要这两个先决条件
139,45,2017-05-05 11:30:00,23272,宝宝差点毁容竟是因为吃了这个！关于过敏你确定了解够了吗？
140,8,2017-05-04 07:22:00,13646,开团︱超人气立体绘本《情绪小怪兽》(英文原版)+暖萌正版玩偶：让宝宝学会与情绪和平相处
141,169,2017-05-03 07:27:00,23596,错过孩子的XX敏感期，是不是会从此毁一生？
142,206,2017-05-02 07:48:00,25946,宝宝总像没吃饱，难道我奶水不够？原来真相是这样…
143,127,2017-04-30 07:48:00,34747,导读 | 生一个还是两个？这22个真相让你不再纠结
144,191,2017-04-28 10:18:00,48035,兼顾事业和家庭，最鸡血的谎言？
145,22,2017-04-27 07:22:00,10851,开团︱可以吃的银鸟12色大米彩泥、应妈妈呼声提供玩法超多的工具套组OR彩泥单品两种团品。安全鲜艳，遇水复原的超人气彩泥限时开售！
146,180,2017-04-26 07:33:00,47466,命大！男孩被铅笔直插心脏，所幸家长没这么做｜你不能不知的8种危急情况急救指南
147,99,2017-04-25 07:39:00,33218,睡吧？吃吧？听话！不要不要！｜T2的他究竟想干嘛？
148,107,2017-04-24 07:31:00,20917,开课 | 六招实战工具箱，六周直播授课，教你轻松突围孩子脾气大、难相处、被欺负、不分享等婴幼儿「社交难题」
149,0,2017-04-10 07:26:00,0,种草｜这20种旅行神器，没它们简直没法带娃出门！
150,0,2017-04-09 09:04:00,0,萌芽 | 如果我有女儿，我会带她去看《美女与野兽》而不是《白雪公主》
151,4,2017-04-07 07:23:00,11307,开团 | 全能搅拌机，“一杯”解决清洗+便携两大难题，还送砧板刀具，作为懒人我已别无他求
152,48,2017-04-06 14:25:00,24832,按下「重启」键，你的婚姻真的会变幸福吗？
153,32,2017-04-05 08:10:00,26537,孩子“补铁”的正确使用指南在此！可能99%的妈妈都错了
154,163,2017-04-02 07:24:00,36395,萌芽｜孩子终有一天会问你死亡的意义，你可以把这故事送给他
155,34,2017-04-01 07:31:00,29011,「这些女人简直是非人类啊！」| 30个一辈子都忘不了的瞬间
156,26,2017-03-31 07:23:00,27120,干货 | 原来我不是买了假的绘本，而是不知道读绘本有72种姿势
157,99,2017-03-30 07:44:00,18833,开团 | 全国知名牙科诊所都在用，超高性价比的专业声波电动牙刷线上首发团！在家便能享受专业洁牙体验
158,167,2017-03-29 07:44:00,65413,两个男孩差点被绑架！ ｜ 10条安全准则，教孩子分辨「狡猾的大人」
159,56,2017-03-28 07:34:00,53937,小学生被食物噎住窒息而亡！3岁以下孩子尤其禁食此物
160,25,2017-03-27 07:39:00,32339,别否认了，当妈后的这些「病」，得治  |  一剂良方
161,193,2017-03-24 07:30:00,32010,想过吗？你为什么那么想要个孩子？
162,6,2017-03-23 07:26:00,15101,开团 | 伟易达明星产品：厨房购物推车，一到五岁适用，助力认知启蒙和习惯养成！
163,22,2017-03-22 07:47:00,18272,洛克菲勒家族给孩子的财商教育 丨 我们怎么跟孩子谈钱
164,53,2017-03-21 07:21:00,31789,电梯“吃人”背后的真相，带孩子乘扶梯的禁忌你犯了多少条？
165,55,2017-03-20 07:25:00,34134,动不动就“炸毛”的T2娃，原来大脑跟我们不一样！
166,44,2017-03-19 08:35:00,33358,像Angelababy那样产后迅速恢复，利用碎片时间就能做到！ | 专业健身教练放大招
167,26,2017-03-17 07:25:00,21447,“我就喜欢你看不惯又拿我没办法” 丨 养娃这事跟爸妈朋友圈过招，拼智慧！
168,6,2017-03-16 07:37:00,13665,开团 | Usborne镇社之作，一套能当绘本+教材看十年的基础英语分级读物
169,34,2017-03-15 07:31:00,24332,你不让孩子自己选，以后不会自主学习可别怪他
170,46,2017-03-14 07:22:00,20252,孩子的英语分级读物如何选，如何用？| 超实用的干货文
171,23,2017-03-13 07:25:00,32293,乐高这个坑，你要跟着我跳吗？（附剁手指南）
172,103,2017-03-12 11:20:00,31314,自信孩子如何养成？李亚鹏给出最佳答案 丨 本文适合与队友共读
173,101,2017-03-10 08:02:00,27986,居然真有人怂恿大家不要打疫苗，你害己不要害人好吗？！
174,40,2017-03-09 07:34:00,25562,夹心饼干长大的孩子：为什么父母一生谨慎却丢了她？
175,166,2017-03-08 07:23:00,32270,都是坑！那些奇葩的防跌倒神器 丨 保护学步期孩子的正确姿势
176,83,2017-03-07 08:31:00,25156,在我们想给孩子正确的性教育时，别拆台好么？（附性教育绘本书单）
177,72,2017-03-06 07:23:00,28512,朗读，是父母给孩子最好的礼物 | 为孩子朗读的13条建议
178,30,2017-03-04 10:18:00,27425,猪队友的“育儿力”仅停留在抱娃？ | YouTube上大火的视频告诉你，爸爸至少能陪娃做好6件事
179,173,2017-03-02 07:51:00,36269,天津大悦城悲剧发生后，当事人到底配不配得到原谅？
180,103,2017-03-01 07:43:00,17197,萌芽 | 在婚姻被埋怨淹没前，我们还能做些什么？
181,163,2017-02-28 08:49:00,37421,一位妈妈自述：天上掉“石头”，我的孩子被砸中了丨公益
182,32,2017-02-27 07:28:00,25585,我可能买了一堆假玩具 丨超牛妈妈这样用乐高得宝和孩子“演”绘本
183,103,2017-02-24 07:24:00,31440,育儿观那么多，你的是哪一种？| 八种父母分别养出了怎样的孩子？
184,5,2017-02-23 07:22:00,16674,​开团︱让孩子笑得停不下来的《小猪小象》最新版首团，零差评口碑推荐！
185,32,2017-02-22 07:35:00,27879,嘘！孩子正在发呆，我们不要打扰丨孩子需要的就是大把的无聊时光啊
186,24,2017-02-21 07:22:00,30035,产后第一年，你遭了多少罪？| 早点知道这个秘密，日子会不会好过一点
187,27,2017-02-20 07:40:00,29428,注意！宝宝跌落后不能立刻抱起 | 正确做法都在这里
188,97,2017-02-17 07:42:00,34493,你有愤怒到想要揍孩子的时候吗？ | 宝宝大脾气背后的真实原因
189,60,2017-02-16 07:35:00,19574,开团 | 重磅级恐龙图画书，横扫北美20多项大奖，轻松养成好习惯！（赠音频）
190,87,2017-02-15 07:49:00,20175,管孩子，他会不会就跟我不亲了？| 爱与规则如何并存
191,89,2017-02-14 07:23:00,22742,这4个环节做好了，孩子轻松拥有一口好牙 | 送给“小情人”一生的礼物(文末有福利)
192,97,2017-02-13 07:23:00,23785,我家囤的塑料袋，八辈子也用不完！| 长辈育儿的9大神癖好
193,119,2017-02-10 08:09:00,23260,逃避计生三十年，她如何走出被扭曲的人生
194,157,2017-02-09 08:04:00,35998,生娃这件事，情出自愿，事过不悔
195,64,2017-02-08 07:26:00,14964,警惕！宝宝睡姿总朝一个方向？| 五个信号鉴别是否“歪脖子”病
196,78,2017-02-07 07:22:00,19553,不吼不骂就能解决教养难题？| 试试这七个“脑洞大”却有效的家庭纪律
197,73,2017-02-06 07:22:00,13705,萌芽 | 一堂国际学校针对三岁孩子的性教育课，比你想象的更接地气！
198,65,2017-02-04 07:33:00,28695,闭上眼睛买都不会出错的重磅有毒种草文 | Mother &amp; Baby 2017年度榜单大赏（上）
199,95,2017-02-02 13:22:00,44980,对于0-4岁的孩子，规则意味着什么 | 四招教你如何温柔而坚定地执行规则
